{
  "$schema": "https://thecompanion.sh/schemas/companion-manifest.v2.schema.json",
  "name": "swiftui-expert-dev",
  "version": "0.1.0",
  "title": "SwiftUI expert",
  "description": "Apply focused SwiftUI and Swift concurrency expertise for state, composition, navigation, performance, accessibility, and testability.",
  "notes": "## What it does\n\nThis is a narrow reusable implementation capability for native iOS work. It helps an owner skill choose safe state ownership, value-driven navigation, structured concurrency, efficient composition, accessible controls, and deterministic tests.\n\n## Boundary\n\nIt does not own product intent, cross-platform visual direction, API authorization, or build/simulator orchestration. Hand those questions to ios-product-dev, design-frontend-dev, and xcodebuildmcp-cli respectively.",
  "metadata": {
    "companionSkillId": "a0e3dc0e-4f95-461e-8f10-43a0658d5d6b",
    "changelog": [
      {
        "version": "0.1.0",
        "date": "2026-08-24",
        "changes": [
          "Add a portable focused SwiftUI implementation capability for Agents and Claude."
        ]
      }
    ]
  },
  "environment": {
    "env": {},
    "secrets": {}
  },
  "dependencies": {},
  "commands": [
    {
      "name": "Refactor SwiftUI state",
      "desc": "Choose stable ownership, identity, navigation, and cancellation boundaries without changing product behavior."
    },
    {
      "name": "Harden a SwiftUI surface",
      "desc": "Cover accessibility, loading/error/empty states, Dynamic Type, reduced motion, and testable interactions."
    },
    {
      "name": "Diagnose SwiftUI performance",
      "desc": "Find unnecessary invalidation, unstable identity, expensive body work, or unstructured async tasks and propose measured fixes."
    }
  ]
}
